company,what_it_is,launch_video_url,video_type,notes
Corgi,AI insurance / financial infrastructure (YC S24),https://x.com/UseCorgi/status/2064788424079659393,X / Twitter post (Corgi official),"Corgi video chosen by the team (official @UseCorgi post). Site https://www.corgi.insure/."
Cursor,AI code editor (Anysphere),https://www.youtube.com/watch?v=An8IM-kPyms,YouTube video,"Cursor video chosen by the team."
Convex,Reactive backend / database,https://www.youtube.com/watch?v=Gw2UTVxLelE,Launch event stream,"Launch Week 'Vibe Week' demo day; channel https://www.youtube.com/@convex-dev for the 1.0 launch video."
OpenAI Codex,AI coding agent,https://www.youtube.com/watch?v=0e-Brv-gS9Q,YouTube video,"Codex video chosen by the team."
Fiber AI,B2B data APIs for sales/recruiting agents (YC S23),https://www.linkedin.com/posts/fiber-ai-yc-backed-has-verified-phones-ugcPost-7354183681902596096-K-h4/,LinkedIn post (YC launch announcement),"YC-posted launch announcement (founders Adi Agashe & Neel Mehta). Site https://www.fiber.ai/."
